match_id,player_name,player_chat,action
24456,LGD.Maybe,thanks ember. tell you. dont buy account. that guy make me lose 2 games. loser,NOT-PROSOCIAL
14545,Kell.ie,laguna? really. wtf. you have euls why use laguna. im not in bottom. hahaha. WTF. es 54 damagew. stupid. why fucking play mmr. fuck you noob. report this lc. fucking noob. lol. yeah sure. GG,NOT-PROSOCIAL
14013,TODASLASCREMASツ,REPORTEN AL VOID. GG TEAM NOOB. JAJ. VOID CUPULA A NADIE. DOOM LOTAR Y BLAMAIL. JAJJAJ. GG. REPORT VOID AN DOOM. REPORT VOID AN DOOM,NOT-PROSOCIAL
5028,SchlurziWurzi,your mum. ehehehe. you sounde rly mad,NOT-PROSOCIAL
26501,RAFL,XD. respect pause. ez. gg lich peruvian. omg xd. ROFL. jajajaja ptmre,NOT-PROSOCIAL
21571,Soy Sauce Party,.... i suck. should have just walked the other way. i was shopping. our mid though.... look at our mid pro itesm. so pro for 1.8 min in. i almost solo kill the aa and pl. and he does nothing. REPORT THIS FUCKIGN PINK. report pink. your es has 11 assists. our kunkaa has 10 . and that's our MID. commend sb. report kunkka. gg report pink,NOT-PROSOCIAL
30972,Hichkas !,raqe quit. u are so smart. are u from yozgat?. Guys. 3 vs 5 ?. really ?. i know u are the one u who atacked to paris. with massive bombs. bs is back. nice,NOT-PROSOCIAL
48872,roronoa,??????????????????????????. hes exagerating ignore him. i just want 4k >_>. dik wtf is going on here. 7-10 offlane es. 6-11 jungle doom. lolz,NOT-PROSOCIAL
18331,ＥARLＧREY♨,necro afk. FU. :D. no its : 'noob team'. :D FINALLY!,NOT-PROSOCIAL
1703,BruceLee_BAM,ur build sucks so hard,NOT-PROSOCIAL
21133,HerpyDerpy,tghf. Ez,NOT-PROSOCIAL
36358,Viniance,dat guy dc-ed. fukkkk. just when we're gonna gang. dammit. well ur just lucky with his lagging. since the start. ==a. dafuq man. don't mind him. ==a. that guy has packet lost. see that?. ~_~. CAN'T. BCOS OF U. read the situation. no use,NOT-PROSOCIAL
21997,Big Tasty,lol says the 1-4 jugg. this jugg still yet to knoq how to carry,NOT-PROSOCIAL
14541,IburnCITIES,hows that ass feel. from that pounding. space created,NOT-PROSOCIAL
11861,Millajovovich,Report slark pls. Report slark. pls. rpeort. Slark. Lol. Report slark ty guys,NOT-PROSOCIAL
19059,Twang,WP. dumb asses. where u going. dumb ass. wer u going. dumb ass. bb for what. 2 hits. ez. no 4k mmr 4 u. noob. chenoy. cheenoise again. huhuhuhu. charm,NOT-PROSOCIAL
12536,|||ypuK <3,daun. y nego dazzle v team. (999999999. wk. kak dela. wk ale. WK. ALE NAHYI. OTVET MNE MRAZ. SHAS VIEBEM VAS. WK. KAK DELA. SUKA. ALE NAHYI. WK ALE. ALE SUKA. EZ NAHYI,NOT-PROSOCIAL
8808,BackTune-メタルギアソリ�,lmao. hurry pls. let's go nigga. lol. ???. gg easy,NOT-PROSOCIAL
45095,Locklear,ggwp. end. ur bad. rofl. worse than bad. my anus is rdy. ggwp,NOT-PROSOCIAL
7661,Pustulio,REPORT SPEC PLS. TWO RADIANCE. SUX SPECTRO ,NOT-PROSOCIAL
48931,Big Billy Clinton,allah akbar. ALLAH AKBAR. you have a cancer. boys. gg,NOT-PROSOCIAL
24210,Jioo.o,then keep quiet im the real O EM JI. fuck chat kill. its seems daz win agains omni. we got 2 creeps. GG. TOO EZ FOR DAZ,NOT-PROSOCIAL
33346,From the sky to deep,report this fukcing lesh. report lestrash plz. fukcing annoying. Gg. leshtrASH,NOT-PROSOCIAL
4032,granis,4 had. fu. lmao. 10 sec bkb. down the drain. gg wp,NOT-PROSOCIAL
39522,Salm,nope. alch farmed more dced than online. gg,NOT-PROSOCIAL
22111,Killer Of Pit,lets wait. he could easly win it. and he failed. 4 dedalus. for real?,NOT-PROSOCIAL
41491,BuLL,juger is noob dont even read him. gg pudge :D,NOT-PROSOCIAL
25409,Uriziel,"report wk, thanks. she hit me. have you guys reported wk for being little bitch yet?. I'm pretty sure it's bitchy wk who lost them the game. at least I won my game",NOT-PROSOCIAL
30638,Food Here,suck my ass. fck u. ahahahaha. so easy,NOT-PROSOCIAL
8453,Solo,c'on. fuckers. rofl. Yea motherfuckers. don't hate me tiny. y iknow. I'm the best. Opa. 2ez4me,NOT-PROSOCIAL
25047,Qmxi.,shalava sdohla. eto glavnoe. ri. jaja pizda. sha ultu poluchu. uznaesh. pedik. kak dila. uebok chmo?. KAK DILA. KAK. ????. nikak. vrku ebat,NOT-PROSOCIAL
27658,WretchedWhistler,4 carrys and noone has items,NOT-PROSOCIAL
48504,StarLorD OverKill,b. gg. COMEND CENTAUR. COMEND CENTAUR PLEASE. FUCKING PERUVIAN,NOT-PROSOCIAL
12683,Neofire,rip 1.5 mins of farm. can you guys report SF for losing mid so bad. you stood in acid non stop. I randomed. first time I've played alch. this patch. it'd be more winable. if you played dota,NOT-PROSOCIAL
3147,GIGABYTE[Dj.Pe!,go end this drow is bad ,NOT-PROSOCIAL
25289,MINDA BLORON,hi. hi wr. run?. ok. RUN. SAD. SORRY. yawa ka. hhaha. where u from. >. ?. w8. how?. 40mins. just wait. im just joking. sad. S. sad. fuck u. ?. suicide. ?. w8. your so idiot wr. no. fail?. did u kill me mid?. hahahha. hahaah. idiot. swap commed wr. swap commend wr. swap commend wr. swap commend we. why?. end it. yawa kaw. commend es,NOT-PROSOCIAL
37785,player 1,the ddos is working. nice. toplane perma afk,NOT-PROSOCIAL
25641,CATITA DEL PERU,kk. CONCHA. DE. MADRE. wtf,NOT-PROSOCIAL
3646,HomerS,NICVE HERO. FUCKTARD. nice level huskar. or better trashskar,NOT-PROSOCIAL
13537,CheesyQueefs,gg. cliff jungle np and jungle cm wp team wp . these 3 bad and think that me af lost us game. god save them. 2 jungle. meta. op,NOT-PROSOCIAL
25697,Дежурный Рак в Бо,whre is your bkb. tards,NOT-PROSOCIAL
7610,Lexosis,get slapped. gg wp,NOT-PROSOCIAL
17480,Well Met,thats safelane slarD?. GG. literally worst team ever. so whatg?. u 4k garbage. thats whats ur mom said when u born. WHY DOES THIS SON OF A BITCH HAVE KILLED CATAPULD. WHY WOULD HE?. check doom game history. his mom is dead for sure. or will gonna die. in short time. HOPE SO. WITH MY ALL SOUL. weeb trash girl. on doom. this slardar. AHAHHA. reported. for doing exact items . he was playing troll sniper. then jugger. then leshark. for sure. as you all does. and you are still 4k. even with it. AHAHA. Ahhah. AND DIE IN HELL WITH UR MOM. WEEABO GIRL. STFU. useles. go 1 x 1. on any hero?. AHAHA. im not adding shit into friends,NOT-PROSOCIAL
48912,Drink,"What a fucking awful Disruptor.. Why the fuck have you not ended it yet?. I mean, holy hell. It's 2v5.. NIGGA FUCK YO TEA. Why are you not in the base?. Finish it you stupid fuck.. Are you kidding? It wasn't a good game at all. WR has downs and Blue and OJ left.. Have your win.",NOT-PROSOCIAL
24377,Raichu,wait pls. lol. armor. lol. Wew. XD. top was a solo dotn even say. if it is ez u guys sucks. mine. lol. lol. bh. XD. lol. Dagon. lol. no hp. fuck jugg. yep. he is retarded. lol. gege. ratted. XD. lol. we win sb. we win,NOT-PROSOCIAL
3148,CORE !,gg wp. report ember. gg ember. ez hc,NOT-PROSOCIAL
12043,fuckink venomancer,yeah go fuck yourself techies picker,NOT-PROSOCIAL
45694,[TS].tealloh,please wait a bit. fuck you wisp. am i speaking russian?. i make best situation out of no situation. kek. me too mate. he just has a thing for not being here. giggles. i'm not even sure he's coming back anymore but i like the fact that you are get pissed off lads. i'm sure you got 5 report slots. sure he is. io has the autisms,NOT-PROSOCIAL
22540,Arothe. /muted all,nice randoms?. solo?. worth. KASACJA CWELA. ROLF. we know it. lol. panic riki;d. lmao. ez. why no opor/. ?,NOT-PROSOCIAL
17704,RamzeS,ez mid. lol. EEEEEEEEEZ INVOKER. lion mid. 1x2. lol. ez invoker. ez inv,NOT-PROSOCIAL
25082,ALWAYSWANNAWIN,terrorist attack. ez,NOT-PROSOCIAL
16485,天堂天堂天堂天堂天堂,?. waiting to die. mid loewr than supp. lawl,NOT-PROSOCIAL
23645,DDZR!!!,lose anyway :). waste time,NOT-PROSOCIAL
37939,tristEas,what a. pls reporrt pudge. wk . with this items,NOT-PROSOCIAL
37227,Uchiha Obito,"gg noobs. ez game , ez life. this team is complete ass . gg",NOT-PROSOCIAL
32769,Smurf.,he is fuck. HHAHA. gg,NOT-PROSOCIAL
20510,Big L,g end. cant win with this invo. gg,NOT-PROSOCIAL
22346,™JOTA,EZ ALL,NOT-PROSOCIAL
38224,Freager,why always me?. gg,NOT-PROSOCIAL
5721,ElMichÖ,COMMED ;V. ALCHE QUE ASKO NO LE HACES NADA ALA PHATOM,NOT-PROSOCIAL
18269,$yXoФрYkTiK,gg ez. ajaj,NOT-PROSOCIAL
43766,cjal,What you don't know is that he's doing a quickie instead ;),NOT-PROSOCIAL
37841,iNda,really?. this IS ranked isn't it?. no habla bean speak. yes I would love a taco . can you finish mowing my lawn first?. i destroyed top,NOT-PROSOCIAL
21072,Up,??. yo invoker. tell you one thing. he doesn't know what tp is... dont tell her that . LOL. yeah report me plesae. for one doesn't know what 'TP' is. let people dive tower mid. what a good mid. gg. yeah. i know. when you againest someone dont know what tp is,NOT-PROSOCIAL
3414,Kings Never Die,u think u won lane ?. wr won u game.,NOT-PROSOCIAL
14828,Baabhabhiat,jaja. died for my sins. gg. im literally wasted and doing better than sven,NOT-PROSOCIAL
32109,Deez_Nuts,pro. ez es. ez es. nubs. es sand king. ez. im not the one that dies the most. lol. rage quit. ez sk. ?. not gonna make a difference. its gg. gg. ez sk,NOT-PROSOCIAL
4426,SLARKERINO,eZ PTS,NOT-PROSOCIAL
28984,Œ,fastest throw. ever,NOT-PROSOCIAL
33558,4Head4Head4Head4Head4Head4Head,rude. pls no bm. mm2. GG. disgusting doom picker. u have no shame. ?. im american. gj,NOT-PROSOCIAL
38613,a-FiZL,enough already. suck it russian. we waited 2 / 3 pauses,NOT-PROSOCIAL
25127,superRust,haha fkin srs lina. u fkin retard. he rq. ez dual mid. garbage lina mid. must be indian isis shit. hahaha so mad lina. 2nd time u ult me with1 hp. im going to buy back with 1 second left. how u lose to this retard sf. gg dont ever go mid again. hahaha. gg dipshits,NOT-PROSOCIAL
41360,ACM1PT. JHON ORTIZ,EZ. MUY FAZIL. ALGO MAS DIFICIL. RATITAS,NOT-PROSOCIAL
24363,Papa Kit,im pro. im pro. im pro. :(. :(. im just a kid. imn pro. FUCK YOU,NOT-PROSOCIAL
33164,d3vilisH1,you mad ahah,NOT-PROSOCIAL
47954,Pet Shop,Lich Slardar. please stop all chatting. How does a lich with a slardar in his lane. Get to all chat rofl. PLease,NOT-PROSOCIAL
40205,FaT,"lol. how. the vision. :(. invo so fed man. from this bad pa. :(. this team is blind people. its ok man the team is useless. a tusk and a pa. doing nothing. tusk thinks he is pro. es took the ,ost important fight. and they still say I am bad. look. at this pathetic. yeah her farm. is amazing. one ulti. lol. how so much dmge",NOT-PROSOCIAL
24251,Reow,we poor asf. u guyz win,NOT-PROSOCIAL
712,fatality,OMG. FREE MMR. sorry,NOT-PROSOCIAL
3729,spidey,worst invoker southamerica ?,NOT-PROSOCIAL
12489,I'm back.,"0-8 mid. free win. finish ty. ez mid, ez game. 0-9 mid. no matter what. it s gg. push bot. no defense. Ez mid, ez game",NOT-PROSOCIAL
7290,edison_razaceleste,EZ INVOKER MANCO. LOL. INVOKER = 2 PODERES. Y QEUIRE SACAR CETRO. JJAJJAJAJA. GOOD DAZZLE AND NAILX. 3 VS 5,NOT-PROSOCIAL
11578,ivica,shut up. already. whiners. ez. dude u suck . dont talk,NOT-PROSOCIAL
5934,Mlcrosoft,we hate losing thats why we flame. its only natural,NOT-PROSOCIAL
21888,"Steven Abootman, Canadian",Is he comign?. Slardar worst player alive,NOT-PROSOCIAL
48247,fidiando ando,ff. ff. gg. end. repor meepo random. en ranked. random en ranked. gg. ff. mid. ff. report meepo. random en ranked. report meepo please. random hero. why roshan?. ff. 2080,NOT-PROSOCIAL
10084,Reinforced.SHINE,GG. GG. nice team. 27min no bf ember. Midlane. GG DONT DEF. GO anc. GG. WP. EMBER IS KID. he is retard. GG. +. reported ember. GL low pririoty,NOT-PROSOCIAL
43832,lungs,lol gyro u suck. wr zz. wha?. lol. thats why u r 800 mmr. lol. HAHAHHA. ok pretend i am wr. 'im so angry because im not good at dota!!!'. 'i wish i was good but im bad so angry me is angry!!!'. 'hey im not noob im pro!!!!!!! fuck u!!!!!'. noob wr gg wp. gg wp. ez WR ez life. EZ WR TOO EZ. ez wr,NOT-PROSOCIAL
28553,spasoje,prepare your anus am. sry but u are gana have it split open while i am puting in 13 inch. he is proly beter than u . u just feeded bot,NOT-PROSOCIAL
24045,GreyZo,lmao. believe fam. lmao. who. i muted him awhile ago lmao. bad and flames. what a combination. u2. first pick sf. is good if you're rtz. lmao. thats y 7 winstreak. lmao. you move like 3k,NOT-PROSOCIAL
22445,Squisher/ <3 Free Syria,sfk. cm. gg wp. report chaos. and onvoker. gg wp plz report our carry and mid. trash mid. trash carry. gg wp,NOT-PROSOCIAL
29002,Geno[S],ember afk,NOT-PROSOCIAL
7925,David Blame,go lina blame more. OMG FAIL MID. SAD. LOSE TO ZUES. :(. REPORT LINA I COMMEND U GUYS. ?. GO. ABUSING COMMUNICATION. FOR FUCKING NOOB. Haha. Reports pls. Thanks. DELETE DOTA 2. STOP PLAYING LINA,NOT-PROSOCIAL
2308,Snugglelump,EZ. EZ. so much help at mid. Still get owned. EZ. EZ. SAD. 0-5. 0-4. lol say thanks to team. Idgaf its ez mid. Slam dunk. SAD. Go farm all game. STFU. go farm all game. EZ mid. So EZ mid. lol. Stupid,NOT-PROSOCIAL
22230,Nesquikk,gg ez pz. reeeeeeeeeee. normies get out,NOT-PROSOCIAL
4791,dont blow my high,can unot . goi shave ur back u autist . no its over . thanks for the courier . brush ur teeth nerdlord,NOT-PROSOCIAL
32486,[FrOzen-Winn]-ヅﮒt٨nﻧη.[,lol. g. izi team. son stupid. izi. gg. ajaaj Riky apeste. hijo pta. ez. ty panthon. los ayuda mucho. end ?. gg. plz. gg. Report panthon plz. ez riky. reverenda kk ,NOT-PROSOCIAL
26355,Ragnar,really. retard team xD. ... pro,NOT-PROSOCIAL
25051,ARE U FOR REAL,gg. report slardar pls. thanks. we still can win. but this oj throw,NOT-PROSOCIAL
34281,Al Bundy (4TDs in 1 game),he doesnt play this game you idiots. kd is a fucking noob,NOT-PROSOCIAL
23635,Sleipnir,"whatever.. top was fucked up because our offlane is like... no tp's, nothing.",NOT-PROSOCIAL
37796,Wiggletphyre,Lame. hey. Why didint i get damage. meh win a duel and not getting bonus damage. Fucking lame. Ez games Ez life. Stop feeding dazzle,NOT-PROSOCIAL
25823,solo mid,ez game,NOT-PROSOCIAL
48055,CD.Buzzbee,ez,NOT-PROSOCIAL
13911,Volvo Rigs Games,<-----------. zeus ult. <-------------. mirana miss more arrows,NOT-PROSOCIAL
34186,Mai xD,PL?. lol. gg. report this bot laner pls... so fucking useless. LOL ur not rich. farm again. bb have dr but always back. so coward. my team get dr.. i dont need that\. coward BB need that DR. gibve it tho him. dont u know ursa BB is so much scared of u??. sorry ill end. REALLY??,NOT-PROSOCIAL
37924,Fullwow,Report pudge. invoker picked first. ez. lol. ez_. ?. Stop talking fucking trashole,NOT-PROSOCIAL
10024,SmoG™,???. ez game. noobs,NOT-PROSOCIAL
18811,hi,lol. ez. commen me. commend me. dire cap. :),NOT-PROSOCIAL
34383,Perturabo,chill bro. just a game. wtf. w8 so fucking long. for that hole. STFU TA. PA. eat a black holw and you can talk PA. dude just do it. black hole that shit,NOT-PROSOCIAL
9075,nwB|PsychoDoc,"u r the problem, not the team :(. u can only farm ",NOT-PROSOCIAL
12514,;..;,report wr. gg. report aa. gg. gg. .... 13-0. lol,NOT-PROSOCIAL
10760,merwin,gg ez,NOT-PROSOCIAL
23170,23,This kunkjka is a bitch. fuck you kunkka. Thats all i can say,NOT-PROSOCIAL
32765,TG.ayahay!!!,pls report mirana. so noob. just end now pl. |and report this fkcing mid,NOT-PROSOCIAL
28383,Farewell,REPORT. OGRE. HE TRY TOO STEAL. MY BOTTLE. BUT HE REUSE. COUR. PRO EGER. ASDF ASDF . CANT STUN. TUSK. )))))))))). finland if the most stupid people. is*. in the world. i have ogre. i cant win. I CANT WIN. WITH THIS. OGRE. WHY SO STUPID PEOPLE. PLAY WITH ME???,NOT-PROSOCIAL
44695,TomiOmnistrife,he rq. i knew him. since we were childs. his father left him. he said he go to the shop. and he didnt come back. since he changed. rekt. bb. okay. rekt. rekt. get fuckin rekt. smallson,NOT-PROSOCIAL
9788,The [R]elevant,ez. gg,NOT-PROSOCIAL
43648,Left^_^Right,thanks. fuck this shit,NOT-PROSOCIAL
5315,"SnapChat this, bitch!",All about the support.. Dat 2-9 speaks for itself.,NOT-PROSOCIAL
49866,B-right?,bkyad. ti mojesh. zalasthitit. ebanoe vse. tebe 130 dali vmesto 270. ne ti yavno ebanutii. gege. 9(99,NOT-PROSOCIAL
38649,il-JumperMT,why the fuck are 4 people farming same camp. really. 2 times in a row. how did you kill me with no evasion. mkb,NOT-PROSOCIAL
24709,BeerGin!!!,8===D. haha,NOT-PROSOCIAL
6345,nokarukuta sakhdasui,report rubick. :v. viva bolivia. .v. EZ TOP . SOY EL SLARK 50-3. ROFL. LOL. EZ MID. EVE. EZ SLARK. ROFL. EZ MID,NOT-PROSOCIAL
25122,Lover,has disconnected from the game. Please wait for them to reconnect.. has abandoned the game. This game is safe to leave. No stats will be recorded. LMAO,NOT-PROSOCIAL
17280,Yennefer,ally chat. please. the fuck. Lol. Raped by grill. english. english. gg babe,NOT-PROSOCIAL
25979,EEG,how win it ?. when supports is nulls. yeah sick team. autoloose. D:D:. ahahaha. :D. go ff . dream team. Fast bf. 20 mnin,NOT-PROSOCIAL
37155,Miracle returns,rat picker. u are antimage,NOT-PROSOCIAL
30242,PEENOISE IN AUCKLAND,worst ember ever,NOT-PROSOCIAL
21673,Catcherwsc,jungle doom. lets CM solo. nice. i love bad bitches. thats my fucknig problem. ty for leaving bot like a bitch doom. free kills on CM. riki fail. ill take jug. cute ult doom. CUM FOR US LIKE BITCHES. CUM BITCH. so cute. gat damn. bane bent u over from the start. and big daddy centaur stuck in right in. sticking it right in. DICK PUNCH. taht dick punch is deadly. bitch ass nigga. chase me plz. Dick punches for all. 19 assist bane ftw,NOT-PROSOCIAL
17683,Epic- Saintz_Jackie,try lose pls. we all thrower. ?. gg. luna your money gone?. :) ,NOT-PROSOCIAL
1757,Social Justice Pusheen,sick sad world. Does this dazzle really have nothing in grave. And this botlane was doing so well,NOT-PROSOCIAL
8113,zxcv,U FUCKED UP. LOL. ROFL. 831 to the face. im reporting invoker. for making this hard. cao ni ma. :d. GO MIDAS AGAIN SLARK,NOT-PROSOCIAL
41547,YOLO,i reatad. wait 3 ins. wait 3 mins. damn. fuck. update. cant fucking conection. nice valve. alright. alright. lol. taht rosh bash. if u keeping this game i will kich all ur ass with dr. nah. waht now putang ina mo bobo nec. so handsome right. so what. not sad ,NOT-PROSOCIAL
49551,STranGeR,lol. haha. dont be panic dude. z. wr. pls dont spam ur skill 2. its hurt. indo ?. u from indo ?. oh same. gg. gg. like i said. dont spam ur skill 2 wr. its hurt. lol,NOT-PROSOCIAL
5990,magic and shit,hi. k. so he is 'reconnection' for 10 minuts?. strange. +. DL:. mad. ?. no support?. bad?. no?. wow.... 7support ?. no?. 5 minute vanguard?. creep skipping?. skip them now. NotLikeThis. trash can. trash cannot,NOT-PROSOCIAL
42157,dave_cheah,fucking u,NOT-PROSOCIAL
25080,hotshot,Put all ur shits in the bag. DDD. WTF,NOT-PROSOCIAL
20219,T_T,holy shit. my team didnt farm at all,NOT-PROSOCIAL
23385,Neks,GGEZ,NOT-PROSOCIAL
39230,Explash........................,soy tu peor  pesadiya ursa. wtf. soy tu peor  pesadiya. soy tu padre,NOT-PROSOCIAL
43668,Kuksu,wait pls. pause pls. fuck off. 2 mins. pause pls. stop being such losers. pause. pls just paise. riki stop getting kills now. Just cause you wer shit. PAUSE!!. just wait. its reborn we all have problems. why not try win for real. ggwp,NOT-PROSOCIAL
5396,FFYL,"trashy picks so far. impress me cunts. The Ursa pcik surprised me a little.. Not really.. Not like I haven't seen Ursa/CM a million times over 6 years. Sick of seeing shitty lineups like yours. Lol it's gay old meta. Same old heroes. Nah, not a faggy meta picker. Ursa is just broken as fuck.x D. I meant picks not game play moron. xD. How honestly do you counter 80% dam reduc?. gg wp. Close game. Lol nah. Lol. Licky cm",NOT-PROSOCIAL
27373,Poker Face,lol. WOAAAH. wanna buy this arcana?. tang ina mo sayang arcana mo. tang ina mo. sayang bm mo. sayang arcana mo. T_T. what amf?. a middle finger?. tang ina mid. ez farm. momonyo. ez mid. ezz. sayang bm mo. bobonyo. bobonyo. bobonyo e bobonyo. bobonyo eh bobonyo. bobonyo eh bobonyo. T_T. we loseee. bobonyo eh bobonyo. bobonyo huskar aegis. blackhole bobonyo. bobonyo no blackhole. bobonyo huskar aegis. bobonyo eh bobonyo. bobonyo eh bobonyo. bobonyo eh bobonyo. bobonyo eh bobonyo. huskar bobonyo aegis?. good. ez game. bobonyo aegis. sayang bb mo. go nc until you fat ~. bobonyo. ez mid ez game. bobonyo eh. cour for what?. bobo will always bobo ~. huskar bobo aegis?. or denied aegis?. denied aegis la. ok good. bobonyo eh. ouch. trash talk more~. tara tara tara. Tere tere tere. bobonyo eh. bobonyo eh. why kill me. nooo. bb for bobo?. bobonyo eh. T_T. bobonyo eh bobonyo. T_T. bb for bobo T_T. hey. its just 25 mmr. let us end la. i just lose my match before. nice try. gg kids. gg kids. ez game. happy?,NOT-PROSOCIAL
27299,SonOfMayhem,peru. thanks. :C. ez?. hahahaha. free farm. 3 kills. and still talking :/. you died 3 times noob. killed by my self. lol. you dont remember?. suck as invo. your doom and rubick are winning this. the shitty trash talker mid. has to. gave me free farm. :). 3vs0. no help. you got help,NOT-PROSOCIAL
42041,[ReaPer] MJCD,why pause ?. we are pinoy idiot. comeback. HAHAHAHA,NOT-PROSOCIAL
5748,fohu,russians are such dumb subhumans lmao,NOT-PROSOCIAL
49486,Ponce de León,report . gg slark,NOT-PROSOCIAL
30156,One_Love_Astana_KZ,n1. xD. commended. n1. n1?. kick from navi pls. disband. with 4. ez coins,NOT-PROSOCIAL
7340,mult,report legion. report legion and meepo. ls. dcp. ya ne znay kak takux derjut zemlya. gg wp. ixi legion . izi. izi meepo. lol. izi bot. ahahah,NOT-PROSOCIAL
29009,Deeeerp,orchid?. really. fucking epic mid. gg wp. DONT FUCKING BLOCK ME,NOT-PROSOCIAL
7406,area-,boring lina,NOT-PROSOCIAL
29502,Bonglord,"how did slark get so fucking farmed. jugg is actually awful. don't worry, he's our carry. the solo bfury shitter jugg. complaining about us. LOL. JHAHAHAHAHA. kid is AWFUL. I destroyed DK mid. but it's my faul we lost. right jugg?. no.... lol. he has 1,600 games on DK??>. WHAT THE FUCK. that's more games than I've ever played. that's actually impressive. taht MKB though. slark singlehandedly won this for you ;[. it's a damn shame. DK deserved a loss lol. no.. you fucking sucked DK. you didn't do shit if you want me to be honest. jesus fucking christ",NOT-PROSOCIAL
13517,Jiang Pho,keep dreaming lads,NOT-PROSOCIAL
48920,SLIMCHIPPY,gg. afk ember too. rmk. w8 to the new year ?. nope. i wanna a rmk. unpause game not counted. ember he cant play at mid. just a gg with a throw ember. indog player. gay,NOT-PROSOCIAL
9859,phenomen,gg. ez,NOT-PROSOCIAL
48668,Dank memes,poor rubick. i. h. a. t. e. Trinidad & Tobago. the life a of a 3rd world dota 2 player,NOT-PROSOCIAL
21447,"6+0=3, trust me",sniper lucky noob. just lucky  storm noob. 31 for fuckin noob sniper. bullshit. fuckin faggot. die,NOT-PROSOCIAL
24885,(ARG) S H I B U /S.T.A.R.S,legion ascoo,NOT-PROSOCIAL
33452,Durrrrrrrrrrrrrr,he's a feeder. so. help he doesnt come back. check last game. yes. so. just gg go next. im a nice guy. i want to enjoy game,NOT-PROSOCIAL
12868,Guinsoo,thanks. g. passive stun.. wp. WP GANK. PRO GANK. what now slardar. too ez :x. easier than your gf. loner man. 3rd tower hurts. well played 3rd tower. Hahaha thats how bad you are you cunt. reported as well. lmao so angry hahaha. ez mid invoker. ez mid. lol. you at mid. too ez,NOT-PROSOCIAL
4142,sakkaya,Best silence. so stop farming and go mid . and finish. he has 3 x less farm than you. report wyvern plz. she left us no chanse. gg,NOT-PROSOCIAL
15074,[AB] PAYEONE,callate mierda. report brist. gg brist. Ag gg team. report. ratas,NOT-PROSOCIAL
35042,Marldoff..!!,ez. commend me. commend,NOT-PROSOCIAL
34184,SuPerBoNi,GG NOOBS,NOT-PROSOCIAL
24500,raptr,always blame. that wr. last game he did it,NOT-PROSOCIAL
22588,"Harvey ""Harvey"" Harvey",gg wp. easiest game of my life,NOT-PROSOCIAL
12415,Anomander Rake,focus me more. when tiny rape you. shithead,NOT-PROSOCIAL
47066,Curious George,EZ MID NOOB,NOT-PROSOCIAL
27116,M chelo ™,RETARD. pa mid nice. XD,NOT-PROSOCIAL
6401,DeezNuts,fuck that. team retard. gg ;/. Fianlly,NOT-PROSOCIAL
1900,hsiangzz,ggwp. worse slark ever. lucky rampae,NOT-PROSOCIAL
32746,Magnog,nice luck. :). zzzzz. they suck so bad. i'm afk. bb. ofc we'd lost to fucking noobs. :). LC ure dogshit rofl. cant believe we just lost. to these guys. they are terrible. rofl. every single one of you. are horrendous. pudge. just so you know :). pudge have you landed 1 gook?. you fucking retard. i didn't think so. so stfu. you fucking clown. i love how this LC thinks he's actually done something this game. actually makes me fucking rofl.. you're shijt. we have no carry. that's how you won. G fucking G. muted,NOT-PROSOCIAL
11404,AmeenO,lmao. dude stop. doom fuck you. nice ult dude. ult at 50 hp. rip. hi,NOT-PROSOCIAL
30317,+25,#repotallrussians. #repotallrussians. #repotallrussians. seee. hoook. im too far. sorry. there is a shade. u cant see me. ). wtf. nice change. ty. gg wp. #repotallrussians,NOT-PROSOCIAL
41122,Deez_Nuts,just wait til you fall off late game noob. ?. noobs. ?. stfu. lol. rage quit. wheres the talk now?. ?. what i thought. ?. i dont think so. ?. shhh. shhh. stfu. peruvian noobs. ez mega creeps. gg nubs. too ez. stfu. ez game,NOT-PROSOCIAL
37276,fR00Py,i realise that it is difficult to kill me. what a waste of AEGIS. LOL. EZ MID. BOTS are more difficult,NOT-PROSOCIAL
45759,Darcco,how?. that you attack me and my ranged creeps. doesn't take the aggro. i didn't get it. they stupid as hell. is that apple net?,NOT-PROSOCIAL
411,Reaper,Lol. gg. noobs. easy. lol. come back. owned. hahahhahahaha. carry wd. LOl,NOT-PROSOCIAL
40522,ZIL 25,GG PERRAS,NOT-PROSOCIAL
30031,WalkStar,noob alc. report la. GGWP. lol. noob sf. stupid,NOT-PROSOCIAL
31101,one$,FUCKING BASTARDS. keep calm and kill storm?. IDIOT. STOP IT. allvison. void?,NOT-PROSOCIAL
43171,Arcadian,"looks like. <3. GG WP. look my team, all negative kill/dead",NOT-PROSOCIAL
27230,JiNJu`진주,zeus say u noob dude. dunno. dunno. wait . commend u. later again. u can wait him  and enjoy watch porn. your nick. fuck. mofos. lag dude. this valentino rossi,NOT-PROSOCIAL
30978,twitch.tv/ΰĐă√,bg ez. ty moron at mid. bg ez. ty sf. and useless morf. trash,NOT-PROSOCIAL
32091,Zothi,storm. bad hero,NOT-PROSOCIAL
39566,Don Sergio,why me. its gg. gg,NOT-PROSOCIAL
14363,HUNTER,LISO ERES NO CTM,NOT-PROSOCIAL
7268,Bosh,"please end, this team barely knows the concept of a last hit. gg my ass. enjoy the free mmr",NOT-PROSOCIAL
